{
  "b_cases": [
    {
      "id": "B01",
      "name": "tool-manifest-runner-qualification",
      "phase": 1,
      "property": "bench doctor qualifies the pinned libraries, wheel provenance, cgroup counters, thread environment and cpuset; a missing item BLOCKS"
    },
    {
      "id": "B02",
      "name": "wall-versus-cpu-and-units",
      "phase": 1,
      "property": "a finite wait has elapsed time without equivalent busy CPU; a bounded compute control consumes measured CPU; ns/us/s and bytes/KiB conversions are exact; resolution and tolerances are declared"
    },
    {
      "id": "B03",
      "name": "descendant-and-short-lived-worker-cpu",
      "phase": 1,
      "property": "CPU of spinning children, a native coreutils child and many short-lived children is in the cgroup total"
    },
    {
      "id": "B05",
      "name": "whole-workload-memory-and-peak",
      "phase": 1,
      "property": "spec 8.4 errors 2-8: child memory in the group peak, no summed peak, largest waited child, shared pages, sampled lower bound, untouched reservation"
    },
    {
      "id": "B09",
      "name": "statistics-and-unstable-outcomes",
      "phase": 1,
      "property": "equal, faster, slower and noisy synthetic datasets, correlated inner samples, missing trials and invalid denominators; insufficient or noisy evidence is INCONCLUSIVE, never retried"
    },
    {
      "id": "B10",
      "name": "python-concurrency-and-runtime-identity",
      "phase": 1,
      "property": "thread and process variants with explicit workers, spawn start method and bounded pending work; real result and error handling; GIL state reported after imports where exposed, never impersonated"
    },
    {
      "id": "B13",
      "name": "measurement-perturbation-and-cache-policy",
      "phase": 1,
      "property": "timing runs apart from cProfile and memory diagnostics with labels; empty-overhead and no-change controls visible; launch and profiling time never mixed into a variant; host tuning requests rejected; echo-control part in Phase 2"
    },
    {
      "id": "B12",
      "name": "resource-and-topology-guardrails",
      "phase": 3,
      "property": "hidden one-CPU availability, oversubscribed workers, unbounded queues, changed nested-library threads or a missing aggregate limit are rejected or blocked before stress; a permitted measured envelope runs; missing multicore capacity is not a fabricated pass"
    },
    {
      "id": "B14",
      "name": "python-first-decision-engine",
      "phase": 3,
      "property": "synthetic policies and data exercise keep-Python, optimize-first, Python-library/concurrency, C-candidate, inconclusive and invalid; a faster isolated C kernel with slower caller cost earns no recommendation; missing objectives or approval never authorize migration"
    },
    {
      "id": "B15",
      "name": "evidence-integrity-and-work-accounting",
      "phase": 3,
      "property": "stale or cross-run metrics, incorrect cgroup identity, altered raw observations, missing failed attempts, forged self-timing, duplicate rows or wrong work counts are rejected; an unmodified real experiment gives traceable raw and summary records"
    },
    {
      "id": "B18",
      "name": "starter-child-and-normal-workflow-integration",
      "phase": 3,
      "property": "bench payload in both starter instances, path with spaces, designated child qualification with real measurement; scaffolding, replay, docs, concurrency policy, metric profiles and runtime exclusion verified; no copied parent measurements or grandchildren"
    }
  ],
  "decision_cases": {
    "policy": {"name": "test-filled", "state": "approved", "demonstration_only": false, "objective": "engine test policy",
      "metric": "wall_ns_per_unit", "modes": ["warm"], "points": ["baseline", "full-dataset"], "relative_threshold": 0.2,
      "min_abs_saving_ns_per_call": 0, "absolute_target_ns_per_unit": null, "target_margin": null, "pool_cpu_guard": 0.25,
      "limits": {"cpu_regression": 0.10, "latency_regression": null, "memory_regression": 0.25}, "sizes": ["medium", "large"], "concurrency": [1, 2, 4]},
    "cases": [
      {"name": "invalid", "expect": {"outcome": "INVALID_EXPERIMENT", "rule": 1}, "status": "VALID", "native_gates": "PASS",
       "opportunity": {"approval": {"state": "APPROVED", "baseline_variant": "py-reference"}, "python_options": [{"name": "vectorization", "state": "measured"}], "operational_costs": {"transport": "stdio frames, bounded", "deployment_artifacts": "the project worker binary", "observability": "bench evidence", "failure_handling": "worker reaped, row failed", "retries_idempotency": "a request is idempotent; no retry", "ownership_abi": "protocol v2 owner: example", "native_boundary_maintenance": "23 project gates"}},
       "blocked": [],
       "rows": [
        {"point": "baseline", "mode": "warm", "variant": "py-reference", "workers": "direct", "route": null, "language": "python", "eligible": true, "wall": 100000, "cpu": 100000, "spread": 0.02, "peak": 50000000, "scope": "caller"},
        {"point": "baseline", "mode": "warm", "variant": "py-optimized", "workers": "direct", "route": null, "language": "python", "eligible": true, "wall": 98000, "cpu": 98000, "spread": 0.02, "peak": 50000000, "scope": "caller"},
        {"point": "baseline", "mode": "warm", "variant": "py-library", "workers": "direct", "route": null, "language": "python-library", "eligible": true, "wall": 99000, "cpu": 99000, "spread": 0.02, "peak": 50000000, "scope": "caller"},
        {"point": "baseline", "mode": "warm", "variant": "py-threads", "workers": 1, "route": null, "language": "python", "eligible": true, "wall": 99000, "cpu": 103950, "spread": 0.02, "peak": 50000000, "scope": "caller"},
        {"point": "baseline", "mode": "warm", "variant": "py-threads", "workers": 2, "route": null, "language": "python", "eligible": true, "wall": 99000, "cpu": 207900, "spread": 0.02, "peak": 50000000, "scope": "caller"},
        {"point": "baseline", "mode": "warm", "variant": "py-threads", "workers": 4, "route": null, "language": "python", "eligible": true, "wall": 99000, "cpu": 415800, "spread": 0.02, "peak": 50000000, "scope": "caller"},
        {"point": "baseline", "mode": "warm", "variant": "py-processes", "workers": 1, "route": null, "language": "python", "eligible": true, "wall": 99500, "cpu": 104475, "spread": 0.02, "peak": 50000000, "scope": "caller"},
        {"point": "baseline", "mode": "warm", "variant": "py-processes", "workers": 2, "route": null, "language": "python", "eligible": true, "wall": 99500, "cpu": 208950, "spread": 0.02, "peak": 50000000, "scope": "caller"},
        {"point": "baseline", "mode": "warm", "variant": "py-processes", "workers": 4, "route": null, "language": "python", "eligible": true, "wall": 99500, "cpu": 417900, "spread": 0.02, "peak": 50000000, "scope": "caller"},
        {"point": "baseline", "mode": "warm", "variant": "c-serial", "workers": "direct", "route": "stdio", "language": "c", "eligible": false, "wall": 97000, "cpu": 97000, "spread": 0.02, "peak": 50000000, "scope": "caller"},
        {"point": "baseline", "mode": "warm", "variant": "c-threads", "workers": 4, "route": "stdio", "language": "c", "eligible": true, "wall": 97000, "cpu": 407400, "spread": 0.02, "peak": 50000000, "scope": "caller"},
        {"point": "full-dataset", "mode": "warm", "variant": "py-optimized", "workers": "direct", "route": null, "language": "python", "eligible": true, "wall": 98000, "cpu": 98000, "spread": 0.02, "peak": 50000000, "scope": "caller"},
        {"point": "full-dataset", "mode": "warm", "variant": "py-library", "workers": "direct", "route": null, "language": "python-library", "eligible": true, "wall": 99000, "cpu": 99000, "spread": 0.02, "peak": 50000000, "scope": "caller"},
        {"point": "full-dataset", "mode": "warm", "variant": "py-threads", "workers": 1, "route": null, "language": "python", "eligible": true, "wall": 99000, "cpu": 103950, "spread": 0.02, "peak": 50000000, "scope": "caller"},
        {"point": "full-dataset", "mode": "warm", "variant": "py-threads", "workers": 2, "route": null, "language": "python", "eligible": true, "wall": 99000, "cpu": 207900, "spread": 0.02, "peak": 50000000, "scope": "caller"},
        {"point": "full-dataset", "mode": "warm", "variant": "py-threads", "workers": 4, "route": null, "language": "python", "eligible": true, "wall": 99000, "cpu": 415800, "spread": 0.02, "peak": 50000000, "scope": "caller"},
        {"point": "full-dataset", "mode": "warm", "variant": "py-processes", "workers": 1, "route": null, "language": "python", "eligible": true, "wall": 99500, "cpu": 104475, "spread": 0.02, "peak": 50000000, "scope": "caller"},
        {"point": "full-dataset", "mode": "warm", "variant": "py-processes", "workers": 2, "route": null, "language": "python", "eligible": true, "wall": 99500, "cpu": 208950, "spread": 0.02, "peak": 50000000, "scope": "caller"},
        {"point": "full-dataset", "mode": "warm", "variant": "py-processes", "workers": 4, "route": null, "language": "python", "eligible": true, "wall": 99500, "cpu": 417900, "spread": 0.02, "peak": 50000000, "scope": "caller"},
        {"point": "full-dataset", "mode": "warm", "variant": "c-serial", "workers": "direct", "route": "stdio", "language": "c", "eligible": true, "wall": 97000, "cpu": 97000, "spread": 0.02, "peak": 50000000, "scope": "caller"},
        {"point": "full-dataset", "mode": "warm", "variant": "c-threads", "workers": 4, "route": "stdio", "language": "c", "eligible": true, "wall": 97000, "cpu": 407400, "spread": 0.02, "peak": 50000000, "scope": "caller"}
       ]},
      {"name": "missing", "expect": {"outcome": "INCONCLUSIVE", "rule": 2}, "status": "VALID", "native_gates": "PASS",